{
  "status": "success",
  "summary": "합성 처리량 2건을 비교했으며 증가 1건과 감소 1건입니다.",
  "records": [
    {
      "record_id": "metric-alpha",
      "title": "가상 알파 처리량",
      "baseline": 40,
      "current": 50,
      "delta": 10,
      "change_percent": 25,
      "unit": "completed_jobs",
      "source_file": "source.json"
    },
    {
      "record_id": "metric-beta",
      "title": "가상 베타 처리량",
      "baseline": 80,
      "current": 60,
      "delta": -20,
      "change_percent": -25,
      "unit": "completed_jobs",
      "source_file": "source.json"
    }
  ],
  "coverage": {
    "complete": true,
    "expected_target_count": 2,
    "completed_target_count": 2,
    "issues": []
  },
  "warnings": [],
  "artifacts": []
}
